{
  "schemaVersion": "0.1.0-draft.1",
  "eventId": "event.review.claimed.001",
  "projectId": "project.demo",
  "sequence": 1,
  "generation": 1,
  "eventType": "review_job.claimed",
  "aggregate": {
    "type": "review_job",
    "id": "job.review.001"
  },
  "actor": {
    "principalId": "principal.reviewer",
    "sessionId": "session.review.001",
    "hostId": "host.demo"
  },
  "occurredAt": "2026-07-12T12:10:00Z",
  "correlationId": "correlation.review.001",
  "idempotencyKey": "idempotency.claim.001",
  "data": {
    "claimId": "claim.review.001",
    "fencingToken": 1
  },
  "hashAlgorithm": "sha256-bridge-cjson-v1",
  "hash": "0b4fc0d3431f10f49d84a6de1e34efcdf78887760e663d1b154e191769147457"
}
